id,text,parent_id,weight,sentiment
152,"English is a constantly changing language. It used to be a language where every letter in a word had a sound when spoken i.e., no silent letters.",149,5,-1
153,"The primary benefits of a universal language would come from its being universal, not anything specific to a constructed language.",148,5,1
154,"Hangul, the Korean writing system, was specifically constructed to be easy to learn [60]. Despite being wholly constructed, it remains a simple and efficient means of communication.",148,5,-1
155,"Constructing a writing system for an existing language and convincing its speakers to use it is a wholly different challenge from constructing an entire new language and convincing people to learn it.",154,5,-1
156,"A constructed universal language could be designed for more efficient, easier, and clearer communication than any current language.",148,5,-1
157,"The adoption of an existing natural language to be universalised could wage war between nations who believe their native language should be universally adopted.",148,5,-1
158,"If linguistic relativity [61] is really a parameter, then an universal language may limit humanity's ability to know/understand some concepts.",1,5,-1
159,"According to a study [62], language seems to have an effect on neurology / cognition / brains – the language [63] connectome [64] is shaped by [65] factors that include native language [66] characteristics.",158,5,1
160,"This does not concern only words or concepts only present in one language or e.g. concepts' climaxes but also grammatical characteristics and so on such as communicability of relations or how words are combined.",158,5,1
161,"Adopting a universal language is not exclusive – people could commonly be or remain bilingual or poly-lingual.",158,5,-1
162,"Although English is an unofficial language in India, people also retain their regional languages and can converse in both.",161,5,1
163,"Learning two languages would be difficult and people would slowly lose their mother tongues in favor of the universal language.",161,5,-1
164,"The universal language could also get translated to people's local or second preferred language using AI tools such as DeepL [28] and novel e.g. GPT-based systems [29].",161,5,1
165,"To translate every culture's sayings would be impossible, due to some words essentially equating to phrases that are heavily culture dependent. A universal language would inherently be culture neutral and therefore such words/phrases would be impossible to translate into a universal language.",158,5,1
166,"People have different needs and functionality, and one language could not be made to suit everyone.",1,5,-1
167,"Some people need a sign language. Some people need a spoken language.",166,5,1
168,"A universal language would benefit the privileged and wealthy and put vulnerable and low-income citizens at a disadvantage.",1,5,-1
169,"This would eradicate the struggle of learning a new language when entering a new country.",1,5,1
170,"Currently, immigrants struggle to integrate into new countries because of language barriers. This has led to countries like Germany [67] introducing strict integration laws that require immigrants to take language classes. A universal language will eradicate these issues.",169,5,1
171,"It would take a considerable amount of time for a universal language to be developed, learned by teachers, and taught to everyone in the world before being able to eradicate language barriers.",170,5,-1
172,"It is difficult to gain employment without speaking the official language of a new country, which leads to difficulties in sustaining yourself and your family [68].",169,5,1
173,"Without learning the language of the new country, it is difficult for refugees [69] to get a job and earn a living.",172,5,1
174,"Almost five per cent [70] of the people living in Toronto cannot speak either of Canada’s official languages, English or French. Over 35 per cent of those people who cannot speak an official language are in poverty and cannot find employment.",172,5,1
175,"The universal language would most likely be used differently in different countries: unique dialects and idioms will be created.",169,5,-1
176,"If the universal language is centrally planned, everyone could have access to the correct use of that language. With better communication technologies it's much easier to maintain a common form for a language.",175,5,-1
177,"it is easier to understand a different dialect of your native language than it is to understand a completely foreign language.",175,5,-1
178,"Learning a new language is an important part of getting to know a culture.",169,5,-1
179,"This frees up people's time and capacities for more meaningful or useful things to learn.",169,5,1
180,"Adopting a universal language takes away traditionalism.",1,5,-1
181,"In medieval times, French was a dominant [12] universal language due to the importance of the French Court and Empire at the time.",40,5,1
182,"The current lingua franca of the world is English. Its international presence is in large part due to the British Empire [13]'s imposing of their language on the many countries they forcefully invaded and colonised.",40,5,1
183,"The bridge languages of choice have not always been those of the most powerful group. Take, for instance, the story of the Indonesian language wherein Malay, the language of a minority group, was chosen over Javanese, the language of the majority and most powerful group.",40,5,-1
184,"In the colonial era of Indonesia, Bahasa Malay was the language of commerce and politics [14]; thus, the language of the elite.",183,5,-1
185,"It is not necessary for the chosen universal language to be an existing language. A new, universally accessible language can be created specially for this purpose.",42,5,-1
186,"Despite varying amounts of overlap, each language has a unique [10] set of phonemes used in that language. Creating a universally accessible one - utilising sounds that all humans could make - would thus be impossible.",185,5,-1
187,"Just as with learning any other foreign language, people can learn to pronounce the phonemes of a universal language if they have to. For example, many people learn English as a foreign language and speak it clearly, despite some of the rare phonemes it has like the ""th"" sound.",186,5,-1
188,"A centrally planned and researched universal language could be designed to have a phoneme system based mostly on very common phonemes.",186,5,-1
189,"Almost all [11] languages have the consonants p, t, k, m, n, and the vowels a i u; these could be the principal sounds chosen and then used in a universal language.",188,5,1
190,"This inequity would only be a problem for the first few generations using the language. If the global effort to unify were gentle, gradual and spanning multiple generations, the changing pains would be minimized. If the change is gradual enough, we will only benefit from it.",42,5,-1
191,"The sense of superiority initially gained by people whose language is adopted by others can remain and cause problems for hundreds of years.",190,5,-1
192,"An entirely new language could be created instead of choosing an existing one.",191,5,-1
193,"It is possible to create a very simple language which is easy for anyone to learn, regardless of their native language.",42,5,-1
194,"If the universal language were decided on by public vote across the world, a democratic and fair decision could be reached and inequity mitigated.",42,5,-1
195,"The universal language would most likely be determined by the powerful.",42,5,1
196,"In medieval times, French was a dominant [12] universal language due to the importance of the French Court and Empire at the time.",195,5,1
197,"The current lingua franca of the world is English. Its international presence is in large part due to the British Empire [13]'s imposing of their language on the many countries they forcefully invaded and colonised.",195,5,1
198,"The bridge languages of choice have not always been those of the most powerful group. Take, for instance, the story of the Indonesian language wherein Malay, the language of a minority group, was chosen over Javanese, the language of the majority and most powerful group.",195,5,-1
199,"In the colonial era of Indonesia, Bahasa Malay was the language of commerce and politics [14]; thus, the language of the elite.",198,5,-1
200,"Learning resources for and exposure to a universal language would vary from nation to nation depending on many different and diffult-to-control factors. While all humans have the ability to acquire a universal language, not all will have the same accessibility to learning that language.",42,5,1
201,"The most logical way to select a universal language would be to choose the most spoken one currently; however, this would mean billions of people would have to learn Mandarin Chinese [15], a very challenging language.",42,5,1
202,"The most spoken language is English. For the purposes of a universal second language it would make more sense to use the language with most speakers instead of the language with most native speakers.",201,5,-1
203,"English [16] is also a challenging language to learn.",202,5,-1
204,"Just as with learning any other foreign language, people can learn to pronounce the phonemes of a universal language if they have to. For example, many people learn English as a foreign language and speak it clearly, despite some of the rare phonemes it has like the ""th"" sound.",120,5,-1
205,"A centrally planned and researched universal language could be designed to have a phoneme system based mostly on very common phonemes.",120,5,-1
206,"Almost all [11] languages have the consonants p, t, k, m, n, and the vowels a i u; these could be the principal sounds chosen and then used in a universal language.",205,5,1
207,"Mother tongues are also constantly evolving, especially, because larger and larger groups need to communicate.",163,5,-1
208,"These AI tools would defeat the purpose of a universal language.",164,5,-1
209,"Any universal language created would inevitably favour one language or language group more than others, which would spark inequity.",168,5,1
210,"It is not necessary for the chosen universal language to be an existing language. A new, universally accessible language can be created specially for this purpose.",209,5,-1
211,"Despite varying amounts of overlap, each language has a unique [10] set of phonemes used in that language. Creating a universally accessible one - utilising sounds that all humans could make - would thus be impossible.",210,5,-1
212,"Just as with learning any other foreign language, people can learn to pronounce the phonemes of a universal language if they have to. For example, many people learn English as a foreign language and speak it clearly, despite some of the rare phonemes it has like the ""th"" sound.",211,5,-1
213,"A centrally planned and researched universal language could be designed to have a phoneme system based mostly on very common phonemes.",211,5,-1
214,"Almost all [11] languages have the consonants p, t, k, m, n, and the vowels a i u; these could be the principal sounds chosen and then used in a universal language.",213,5,1
215,"This inequity would only be a problem for the first few generations using the language. If the global effort to unify were gentle, gradual and spanning multiple generations, the changing pains would be minimized. If the change is gradual enough, we will only benefit from it.",209,5,-1
216,"The sense of superiority initially gained by people whose language is adopted by others can remain and cause problems for hundreds of years.",215,5,-1
217,"An entirely new language could be created instead of choosing an existing one.",216,5,-1
218,"It is possible to create a very simple language which is easy for anyone to learn, regardless of their native language.",209,5,-1
219,"If the universal language were decided on by public vote across the world, a democratic and fair decision could be reached and inequity mitigated.",209,5,-1
220,"The universal language would most likely be determined by the powerful.",209,5,1
221,"In medieval times, French was a dominant [12] universal language due to the importance of the French Court and Empire at the time.",220,5,1
222,"The current lingua franca of the world is English. Its international presence is in large part due to the British Empire [13]'s imposing of their language on the many countries they forcefully invaded and colonised.",220,5,1
223,"The bridge languages of choice have not always been those of the most powerful group. Take, for instance, the story of the Indonesian language wherein Malay, the language of a minority group, was chosen over Javanese, the language of the majority and most powerful group.",220,5,-1
224,"In the colonial era of Indonesia, Bahasa Malay was the language of commerce and politics [14]; thus, the language of the elite.",223,5,-1
225,"Learning resources for and exposure to a universal language would vary from nation to nation depending on many different and diffult-to-control factors. While all humans have the ability to acquire a universal language, not all will have the same accessibility to learning that language.",209,5,1
226,"The most logical way to select a universal language would be to choose the most spoken one currently; however, this would mean billions of people would have to learn Mandarin Chinese [15], a very challenging language.",209,5,1
227,"The most spoken language is English. For the purposes of a universal second language it would make more sense to use the language with most speakers instead of the language with most native speakers.",226,5,-1
228,"English [16] is also a challenging language to learn.",227,5,-1
229,"Citizens who are unable to learn the new universal language would be excluded from public discourse as well from political and economic life.",168,5,1
230,"Women, especially those who are stay-at-home housewives, are likely to be excluded as studies have found that employed men learn a new language faster than stay-at-home housewives (Linguistic Diversity and Social Justice, p.49 [22]).",229,5,1
231,"A very high number of low-income Indians can not understand government documents and tax returns in India [23], where English is the official language in addition to various native languages.",229,5,1
232,"All humans speak a language meaning they have the ability to learn language.",229,5,-1
233,"The Critical Period [24] theory states that the human capability to acquire language to a native level is lost after childhood.",232,5,-1
234,"MIT Scientists conducted 2018 studies that proved many adult-learners - and not just children - capable of reaching native-like fluency [25] in a second language.",233,5,-1
235,"Learning resources for and exposure to a universal language would vary from nation to nation depending on many different and diffult-to-control factors. While all humans have the ability to acquire a universal language, not all will have the same accessibility to learning that language.",232,5,-1
236,"In particular the elderly would have issues with learning a new language.",229,5,1
237,"A study found that older brains [26] are slower due to years of stored up information.",236,5,1
238,"Teach the language only to the students until only people who know the language are still alive.",236,5,-1
239,"It is a matter of how rather than whether to implement. Although possible exclusion may be an obstacle to adopting a universal language, the same can be said for any monolingual language policies such as those related to implementing a national language of a newly made country, but the obstacle does not undervalue the potential benefits of a national language as this is more of a question of implementation.",229,5,-1
240,"Establishing a national language for a newly made country typically means that the majority of individuals living in said country already speak the language, and thus there is minimal to no extra teaching required. If the country is developing a new language, typically it is heavily derived, if not a variation, of a preexisting language (take U.S. English vs. British English) in which the same rules apply.",239,5,-1
241,"Different dialects of English are spoken in Australia, the UK, and the USA, but any one of these dialects is easily understandable to a speaker of any other dialect.",177,5,1
242,"As language is part of identity [36], this will take away one means of self-expression.",180,5,1
243,"Having a universal language would not erase personality or culture entirely. In the same way that body language and gestures are used now, people would still find ways to express themselves through a universal language.",242,5,-1
244,"It is impossible to learn some languages without learning about their culture because they are dependent heavily on context. A universal language will take away this unique aspect of some cultures.",180,5,1
245,"The Japanese culture and language are linked [37] and it is impossible to learn one without the other.",244,5,1
246,"Traditional beliefs or practices are important to both individuals as well as societies.",180,5,-1
247,"Tradition contributes to the sense of belonging and gives people identity.",246,5,1
248,"societies are constantly appropriating traditions from other cultures. Nothing is stagnant.",246,5,-1
249,"Traditionalism tends to have, at least in most cases, a negative affect. Traditions and culture can be and tend to be, separate.",180,5,-1
250,"Having a universal language would not mean banning other languages. People would still be able to speak their native language and learn other people's languages if they so wished.",180,5,-1
