id,text,parent_id,weight,sentiment
1,"Thesis: We should adopt a universal language.","",5,1
2,"A universal language would threaten linguistics and cultural diversity, eradicating the benefits of the latter.",1,5,-1
3,"The various different languages of the world all come with unique and peculiar ways to understand everything around them. Adopting a universal language would strip humanity away from one of the richest diversity factors and we would, without a doubt, miss out on so many experiences tied uniquely to language.",2,5,1
4,"Language is a key factor in culture.",3,5,1
5,"The way in which language is constructed in different tongues is believed by some linguists to be indicative of what is, or was, culturally important to the people(s) who use, or used, that language to communicate.",4,5,1
6,"The existence and use of an extensive system of honorifics [1] and differing speech registers [2] in the Japanese language arguably reflects the high cultural importance [3] attributed to politeness and social hierarchies in Japanese society.",5,5,1
7,"Languages can greatly influence their speakers' perceptions of time and space [4].",3,5,1
8,"It is possible to speak the same language and still have cultural diversity. This is evident by the stark difference in the cultural practices of countries who have a majority of native English speakers.",2,5,-1
9,"The United Kingdom [5] and Australia [6] both have a majority of native English speakers and yet there are vast [7] cultural differences [8] between the two.",8,5,1
10,"A universal language would eradicate the negative effects of linguistic imperialism and linguicism [9].",2,5,-1
11,"Any universal language created would inevitably favour one language or language group more than others, which would spark inequity.",10,5,-1
12,"It is not necessary for the chosen universal language to be an existing language. A new, universally accessible language can be created specially for this purpose.",11,5,-1
13,"Despite varying amounts of overlap, each language has a unique [10] set of phonemes used in that language. Creating a universally accessible one - utilising sounds that all humans could make - would thus be impossible.",12,5,-1
14,"Just as with learning any other foreign language, people can learn to pronounce the phonemes of a universal language if they have to. For example, many people learn English as a foreign language and speak it clearly, despite some of the rare phonemes it has like the ""th"" sound.",13,5,-1
15,"A centrally planned and researched universal language could be designed to have a phoneme system based mostly on very common phonemes.",13,5,-1
16,"Almost all [11] languages have the consonants p, t, k, m, n, and the vowels a i u; these could be the principal sounds chosen and then used in a universal language.",15,5,1
17,"This inequity would only be a problem for the first few generations using the language. If the global effort to unify were gentle, gradual and spanning multiple generations, the changing pains would be minimized. If the change is gradual enough, we will only benefit from it.",11,5,-1
18,"The sense of superiority initially gained by people whose language is adopted by others can remain and cause problems for hundreds of years.",17,5,-1
19,"An entirely new language could be created instead of choosing an existing one.",18,5,-1
20,"It is possible to create a very simple language which is easy for anyone to learn, regardless of their native language.",11,5,-1
21,"If the universal language were decided on by public vote across the world, a democratic and fair decision could be reached and inequity mitigated.",11,5,-1
22,"The universal language would most likely be determined by the powerful.",11,5,1
23,"In medieval times, French was a dominant [12] universal language due to the importance of the French Court and Empire at the time.",22,5,1
24,"The current lingua franca of the world is English. Its international presence is in large part due to the British Empire [13]'s imposing of their language on the many countries they forcefully invaded and colonised.",22,5,1
25,"The bridge languages of choice have not always been those of the most powerful group. Take, for instance, the story of the Indonesian language wherein Malay, the language of a minority group, was chosen over Javanese, the language of the majority and most powerful group.",22,5,-1
26,"In the colonial era of Indonesia, Bahasa Malay was the language of commerce and politics [14]; thus, the language of the elite.",25,5,-1
27,"Learning resources for and exposure to a universal language would vary from nation to nation depending on many different and diffult-to-control factors. While all humans have the ability to acquire a universal language, not all will have the same accessibility to learning that language.",11,5,1
28,"The most logical way to select a universal language would be to choose the most spoken one currently; however, this would mean billions of people would have to learn Mandarin Chinese [15], a very challenging language.",11,5,1
29,"The most spoken language is English. For the purposes of a universal second language it would make more sense to use the language with most speakers instead of the language with most native speakers.",28,5,-1
30,"English [16] is also a challenging language to learn.",29,5,-1
31,"Currently, an EU language regime based on English, French and German would disenfranchise 26% to 49% [17] of EU residents.",10,5,1
32,"EU citizens who did not speak those 3 languages would not have immediate and equal access to EU legal documents, official publications, announcements, or parliamentary debates, and would therefore not have as immediate and equal access to the benefits that such information could bring.",31,5,1
33,"Linguistic hierarchies stemming from colonial times persist in much of the world, meaning that there are currently inevitable barriers to success for those who do not speak a lingua franca as their mother tongue.",10,5,1
34,"English and other languages historically spoken by the wealthier parts of the world dominate the world of commerce, meaning that it is most often the already-privileged who are able to participate most successfully in international business.",33,5,1
35,"Research shows that students in countries like Bangladesh [18] and Nigeria [19] have to face socio-economic disadvantages because of their inability to afford good English lessons.",34,5,1
36,"Many non-standard dialects and creoles deriving from a mixture of languages and cultures are often viewed as substandard, and people can be discriminated against for use of this language.",33,5,1
37,"Having one universal language will not solve this problem and people will still have different dialects, based on their own upbringing and culture. This can already be seen in the case of American English, which has 24 different dialects [20].",36,5,-1
38,"AAVE (African American Vernacular English) is often stigmatised [21] as a lazy or unintelligent dialect of English.",36,5,1
39,"Creating a universal language to smooth over the issue of linguicism is to sweep prejudice and discrimination under the carpet. These issues should be addressed at the root and not merely on a surface level.",10,5,-1
40,"The universal language would most likely be determined by the powerful.",10,5,-1
41,"A universal language would benefit the privileged and wealthy and put vulnerable and low-income citizens at a disadvantage.",10,5,-1
42,"Any universal language created would inevitably favour one language or language group more than others, which would spark inequity.",41,5,1
43,"Citizens who are unable to learn the new universal language would be excluded from public discourse as well from political and economic life.",41,5,1
44,"Women, especially those who are stay-at-home housewives, are likely to be excluded as studies have found that employed men learn a new language faster than stay-at-home housewives (Linguistic Diversity and Social Justice, p.49 [22]).",43,5,1
45,"A very high number of low-income Indians can not understand government documents and tax returns in India [23], where English is the official language in addition to various native languages.",43,5,1
46,"All humans speak a language meaning they have the ability to learn language.",43,5,-1
47,"The Critical Period [24] theory states that the human capability to acquire language to a native level is lost after childhood.",46,5,-1
48,"MIT Scientists conducted 2018 studies that proved many adult-learners - and not just children - capable of reaching native-like fluency [25] in a second language.",47,5,-1
49,"Learning resources for and exposure to a universal language would vary from nation to nation depending on many different and diffult-to-control factors. While all humans have the ability to acquire a universal language, not all will have the same accessibility to learning that language.",46,5,-1
50,"In particular the elderly would have issues with learning a new language.",43,5,1
51,"A study found that older brains [26] are slower due to years of stored up information.",50,5,1
52,"Teach the language only to the students until only people who know the language are still alive.",50,5,-1
53,"It is a matter of how rather than whether to implement. Although possible exclusion may be an obstacle to adopting a universal language, the same can be said for any monolingual language policies such as those related to implementing a national language of a newly made country, but the obstacle does not undervalue the potential benefits of a national language as this is more of a question of implementation.",43,5,-1
54,"Establishing a national language for a newly made country typically means that the majority of individuals living in said country already speak the language, and thus there is minimal to no extra teaching required. If the country is developing a new language, typically it is heavily derived, if not a variation, of a preexisting language (take U.S. English vs. British English) in which the same rules apply.",53,5,-1
55,"In medieval times, French was a dominant [12] universal language due to the importance of the French Court and Empire at the time.",10,5,1
56,"Differences between languages are often due to differing cultures [27]. A specific language reflects a specific culture; to sideline different native languages in favour of a universal one would be to sideline cultural diversity.",2,5,1
57,"Without linguistic and cultural variation, once-different linguistic and/or cultural groups would be more vulnerable to problematic or dangerous group thought and propaganda on a global scale.",2,5,1
58,"People could still retain their mother tongue while learning to be conversant in a universal language.",2,5,-1
59,"Although English is an unofficial language in India, people also retain their regional languages and can converse in both.",58,5,1
60,"Learning two languages would be difficult and people would slowly lose their mother tongues in favor of the universal language.",58,5,-1
61,"Mother tongues are also constantly evolving, especially, because larger and larger groups need to communicate.",60,5,-1
62,"The universal language could also get translated to people's local or second preferred language using AI tools such as DeepL [28] and novel e.g. GPT-based systems [29].",58,5,1
63,"These AI tools would defeat the purpose of a universal language.",62,5,-1
64,"Many different cultures speak the same language and yet have been able to retain their cultural uniqueness.",2,5,-1
65,"Many Indians [30] speak English and yet have made it their own by assimilating it into Hindu culture.",64,5,1
66,"There are no benefits to cultural diversity that could not accrue without it.",2,5,-1
67,"Touted as a benefit of cultural diversity [31] are benefits that would accrue from knowledge of a particular culture. However, with no diversity everyone would have that knowledge.",66,5,1
68,"Diversity itself is touted as bringing different approaches [32] to work. However, the nature of cultures is that they have inertia, so there is no expectation that the most efficient approach would be adopted by all, or even any.",66,5,1
69,"Where change is possible, the most vocal, most senior, most obsequious, and least discriminated against all have an edge, regardless of the efficiency of their chosen approach.",68,5,1
70,"If an approach is the most efficient by a large margin, then it will naturally take over other approaches over time by naturally being more successful than other methods.",68,5,-1
71,"At least 43% of the world's 6000 languages are currently endangered [33]. Adopting a universal language would only exacerbate this issue.",2,5,1
72,"A universal foreign language, on the contrary, would aid in the preservation of endangered languages.",71,5,-1
73,"In order to communicate with the wider world, native speakers of endangered languages must often learn multiple other languages. With the implementation of a universal language, they would reduce this to one foreign language, allowing them more time to focus on their native language.",72,5,1
74,"A universal language could help make research, information and other resources for small languages more easily accessible in the wider world, which would help fight linguistic extinction.",72,5,1
75,"Having a universal language would not mean banning other languages. People would still be able to speak their native language and learn other people's languages if they so wished.",71,5,-1
76,"A very common reason for language extinction is globalisation, which leads to the gradual abandonment of native languages in favour of a lingua franca. There would be no difference in this phenomenon if the lingua franca were to be a new, universal one.",71,5,1
77,"While international trade often encourages lingua francas, the result has historically been a stable, healthy bilingualism between native languages and lingua francas, not death or endangerment of the native language.",76,5,-1
78,"Endangerment and extinction of little-spoken, localised languages is an inevitable by-product of an increasingly urbanised and globalised world. This is not an issue to be solved, but rather a natural process.",71,5,-1
79,"According to predictions, 90% of mankind's languages will have disappeared by the end of this century, even without the introduction of a universal language (The world's languages in crisis, p.4 [34]).",78,5,1
80,"There are factors that exclude the aspect of linguistics as a factor of cultural diversity such as clothing, art, and occasions.",2,5,-1
81,"This may raise foreign influence on people, e.g. reducing cultural variability (diversity of cultures) as in cultural globalization [35] to some extent and domestic policy-decision-making. People may often oppose such to some extent.",2,5,1
82,"The possibility for foreigners to contribute to domestic policy-related debates can often be a good thing.",81,5,-1
83,"This is unlikely to reduce cultural diversity any more than the prevalence of English does.",81,5,-1
84,"Adopting a universal language takes away traditionalism.",2,5,1
85,"As language is part of identity [36], this will take away one means of self-expression.",84,5,1
86,"Having a universal language would not erase personality or culture entirely. In the same way that body language and gestures are used now, people would still find ways to express themselves through a universal language.",85,5,-1
87,"It is impossible to learn some languages without learning about their culture because they are dependent heavily on context. A universal language will take away this unique aspect of some cultures.",84,5,1
88,"The Japanese culture and language are linked [37] and it is impossible to learn one without the other.",87,5,1
89,"Traditional beliefs or practices are important to both individuals as well as societies.",84,5,-1
90,"Tradition contributes to the sense of belonging and gives people identity.",89,5,1
91,"societies are constantly appropriating traditions from other cultures. Nothing is stagnant.",89,5,-1
92,"Traditionalism tends to have, at least in most cases, a negative affect. Traditions and culture can be and tend to be, separate.",84,5,-1
93,"Having a universal language would not mean banning other languages. People would still be able to speak their native language and learn other people's languages if they so wished.",84,5,-1
94,"A universal language would reveal and strengthen our common humanity across the globe and across cultures.",1,5,1
95,"Personal misunderstandings could be avoided if we all communicate in the same native language.",94,5,1
96,"English has words from over 100 countries, so it is the most universal language. We may need an universal language call American that jettisons the antiquated English rules of pronunciation and spelling.",94,5,1
97,"Having the time and money to learn a new language is a privilege that not everybody has. In the widespread introduction of a universal language, poor and developing countries could be left behind, which is likely to further divide people.",94,5,-1
98,"This allows people to form better relationships and learn more about each other's lives, beliefs and perspectives.",94,5,1
99,"Factors other than a mutual language are necessary to form bonds or build relationships.",98,5,-1
100,"There are divisions between or within societies who share a common language.",99,5,1
101,"Both in North and South Korea the same language is spoken, but the countries are quite isolated (for various reasons).",100,5,1
102,"If there is animosity between two separate societies who share a common language, this is often the fruit of a historically colonial or dictatorial power dynamic.",100,5,-1
103,"Regardless of other factors, language is a primary barrier, which has to be overcome to ensure the process of building a relationship begins at all.",99,5,-1
104,"This is already possible via the internet and with, e.g, G. Translate.",98,5,-1
105,"Google Translate, while getting better, still cannot take the place of actual knowledge of a language when correct communication is essential",104,5,-1
106,"It would at most increase how many people can better form relationships or generally learn more about each other as widespread understanding of English already allows that.",98,5,-1
107,"You can talk to anyone at any time with out the complications of language barrier.",98,5,1
108,"The difficulties associated with the implementation of such a language would outweigh the benefits.",1,5,-1
109,"Adoption would be a long-term project over hundreds of years, which would largely solve problems of learning and transmission of the UL.",108,5,-1
110,"There is no language with enough users that it would not cause large revolts by the public over it being chosen as the universal language.",108,5,1
111,"An entirely new language could be created instead of choosing an existing one.",110,5,-1
112,"A acquisition of learning a universal language would be time-consuming.",108,5,1
113,"Having a universal language is impossible, because in different parts of the world this language would change over time creating ""dialects of the universal language"", which would end up becoming languages different from each other.",108,5,1
114,"People who speak a common language do not develop different dialects simply as a direct consequence of living in different places, but as a consequence of not using the common language between each other due to geographical barriers. As modern technology breaks down such barriers to communication, there is no longer this reason for dialects to diverge.",113,5,-1
115,"You are right but the physical barriers remain: even if there was only one language you would speak more with the people who live near you and whom you meet every day. Internet cannot prevent the creation of dialects because it cannot eliminate physical barriers. For example, those who live in Italy (like me) would develop an Italian dialect, because Italians would talk more with other Italians they live with. In fact, even if I know English, I (obviously) speak a lot more with other Italians.",114,5,-1
116,"it is easier to understand a different dialect of your native language than it is to understand a completely foreign language.",113,5,-1
117,"Different dialects of English are spoken in Australia, the UK, and the USA, but any one of these dialects is easily understandable to a speaker of any other dialect.",116,5,1
118,"In the globalized world, and after such a universal language has been established, dialects would not become separate languages anymore.",113,5,-1
119,"Math could benefit from a universal language, i.e. characters and symbols used.",108,5,-1
120,"Despite varying amounts of overlap, each language has a unique [10] set of phonemes used in that language. Creating a universally accessible one - utilising sounds that all humans could make - would thus be impossible.",108,5,1
121,"Learning resources for and exposure to a universal language would vary from nation to nation depending on many different and diffult-to-control factors. While all humans have the ability to acquire a universal language, not all will have the same accessibility to learning that language.",108,5,1
122,"A universal language would benefit the economy and society.",1,5,1
123,"A common language [38] helps build trust in trading and business relationships.",122,5,1
124,"Trust is key factor [39] for successful transactions and business.",123,5,1
125,"Without language barriers, companies have access to a larger pool of professionals.",122,5,1
126,"A universal language could harm some domestic economies as service industry jobs can be outsourced to cheaper countries.",122,5,-1
127,"The outsourcing of call-centres [40] to lower cost English-speaking countries impacts local job markets.",126,5,1
128,"This only affects service jobs that do not require physical presence.",126,5,-1
129,"These jobs are still important to the economy business infrastructure (not to mention the people working these jobs), so they shouldn't be disregarded as unimpactful.",128,5,-1
130,"A universal language means companies, especially small companies, wouldn't need to spend money on translators in order to reach wider markets.",122,5,1
131,"People who have better command of the lingua franca have higher salaries [41]; adopting a universal language would allow people to access these advantages.",122,5,1
132,"Adopting a universal language would result in a greater number of people speaking it, reducing the competitive advantage mentioned.",131,5,-1
133,"English is already a widely adopted second language, indicating this practice is beneficial and has widespread support.",122,5,1
134,"Data indicates that in most countries of Europe [42], most adults have at least a moderate proficiency of English. Worldwide, as of 2023, at least 63 countries [43] have an EF English Proficiency Index of at least moderate proficiency when not including countries where English is the main native language.",133,5,1
135,"English Wikipedia has far more articles than any other language [44] WP, higher quality more in-depth content [45], is the most read [46] WP, is the most actively edited [47] WP, and is used as the main WP in the largest number of countries [48].",133,5,1
136,"It can make work more efficient and help eliminate redundant duplicate work such as when things are written again in another English or translation requirements. In science, the widespread practice of publishing studies in English proves such advantages.",122,5,1
137,"A universal language is not needed or not very beneficial anymore now that machine translation, with tools like SoniTranslate [49] or DeepL [50], is approximating efficacy that enables swift translation across languages.",122,5,-1
138,"A universal language would be instrumental in improving international relations.",1,5,1
139,"At least 91 languages [51] in the world have 10 million first language speakers but the United Nations only has 6 official [52] languages.",138,5,1
140,"Translating some languages can be expensive [53] and time-consuming, which can cause delays [54] in the translation of important documents.",138,5,1
141,"More than 450,000 pages [55] per year are translated by the UN’s Text Processing Units.",140,5,1
142,"Translation errors may occur in the process, leading to misunderstandings.",140,5,1
143,"Different languages are not a huge barrier when it comes to international relations because every country has interpreters [56], translators, politicians, diplomats and advisers that are fluent in foreign languages.",138,5,-1
144,"90 per cent [57] of the British Diplomatic Service lacks recognized language abilities or language confidence for the country where they are posted, which makes Britain lose out on trade deals.",143,5,-1
145,"Only one third [58] of British diplomats working in Arab countries are fluent in Arabic.",144,5,1
146,"International relations would be much easier if they didn't have to go through those translators.",143,5,-1
147,"International relations may not be bettered even with a universal language as exemplified by the ongoing hostility between North and South Korea despite sharing a common tongue.",138,5,-1
148,"Compared to the obvious alternative - universal adoption of an existing natural language - developing a universal constructed language is impractical and offers little benefit.",1,5,-1
149,"Existing major languages already have hundreds of millions of speakers, whereas a new constructed language would have to start from zero.",148,5,1
150,"Esperanto failed because it was difficult to find other speakers, is it was not anyone's mother tongue [59].",149,5,1
151,"The English language has more words from other languages than any other, making it a naturally universal language with no necessary edict.",149,5,-1
